MovieID,Title,MPAA_Rating,Budget,Gross,Release_Date,Genre,Runtime,Rating,Rating_Count,Summary
107,Star Trek: Generations-1994,PG,35000000,118000000,11/17/1994,Science Fiction,118,8.5,869127,"With the help of long presumed dead Captain Kirk, Captain Picard must stop a deranged scientist willing to murder on a planetary scale in order to enter a space matrix."
114,Disclosure-1994,R,55000000,214000000,12/9/1994,Drama,123,6.1,43455,"A computer specialist is sued for sexual harassment by a former lover turned boss who initiated the act forcefully, which threatens both his career and his personal life."
102,Dumb and Dumber-1994,PG-13,17000000,247300000,12/16/1994,Comedy,107,7.3,334497,"After a woman leaves a briefcase at the airport terminal, a dumb limo driver and his dumber friend set out on a hilarious cross-country road trip to Aspen, to return the briefcase to its owner."
106,Legends of the Fall-1994,R,30000000,160600000,12/16/1994,Drama,133,7.5,136361,"In the early 1900s, three brothers and their father living in the remote wilderness of Montana are affected by betrayal, history, love, nature, and war."
123,Father of the Bride Part II-1995,PG,30000000,76600000,2/10/1995,Comedy,106,6,31971,"George Banks must deal not only with the pregnancy of his daughter, but also with the unexpected pregnancy of his wife."
120,While You Were Sleeping-1995,PG,17000000,182000000,4/21/1995,Romance,103,6.7,85626,A hopeless romantic Chicago Transit Authority token collector is mistaken for the fiancï¿½e of a coma patient.
132,Crimson Tide-1995,R,53000000,157400000,5/12/1995,Thriller,116,7.3,95145,"On a U.S. nuclear missile sub, a young First Officer stages a mutiny, to prevent his trigger happy Captain from launching his missiles, before confirming his orders to do so."
137,Die Hard: With a Vengeance-1995,R,90000000,366100000,5/19/1995,Thriller,128,5.4,224254,"John McClane and a Harlem store owner are targeted by German terrorist Simon Gruber in New York City, where he plans to rob the Federal Reserve Building."
136,Braveheart-1995,R,70000000,213200000,5/24/1995,Action,177,8.3,907287,"When his secret bride is executed for assaulting an English soldier who tried to rape her, William Wallace begins a revolt against King Edward I of England."
129,Casper-1995,PG,55000000,287900000,5/26/1995,Family,100,6.1,110490,An afterlife therapist and his daughter meet a friendly young ghost when they move into a crumbling mansion in order to rid the premises of wicked spirits.
130,Congo-1995,PG-13,50000000,152000000,6/9/1995,Drama,109,5.2,39870,"When an expedition to the African Congo ends in disaster, a new team is assembled to find out what went wrong."
133,Pocahontas-1995,G,55000000,346100000,6/14/1995,Animation,81,6.7,156670,An English soldier and the daughter of an Algonquin chief share a romance when English colonists invade seventeenth-century Virginia.
138,Batman Forever-1995,PG-13,100000000,336600000,6/16/1995,Action,121,5.4,224254,"Batman must battle former district attorney Harvey Dent, who is now Two-Face and Edward Nygma, The Riddler with help from an amorous psychologist and a young circus acrobat who becomes his sidekick, Robin."
131,Apollo 13-1995,PG,52000000,355200000,6/30/1995,Drama,140,7.6,250975,NASA must devise a strategy to return Apollo 13 to Earth safely after the spacecraft undergoes massive internal damage putting the lives of the three astronauts on board in jeopardy.
139,Waterworld-1995,PG-13,175000000,264200000,7/28/1995,Action,135,6.2,169984,"In a future where the polar ice-caps have melted and Earth is almost entirely submerged, a mutated mariner fights starvation and outlaw smokers, and reluctantly helps a woman and a young girl try to find dry land."
121,Dangerous Minds-1995,R,23000000,179500000,8/11/1995,Crime,99,6.5,45479,An ex-Marine turned teacher struggles to connect with her students in an inner city school.
128,Se7en-1995,R,33000000,327300000,9/22/1995,Action,127,8.6,1323681,"Two detectives, a rookie and a veteran, hunt a serial killer who uses the seven deadly sins as his motives."
126,Get Shorty-1995,R,30000000,115100000,10/20/1995,Comedy,105,6.9,72078,"A mobster travels to Hollywood to collect a debt, and discovers that the movie business is much the same as his current job."
124,Toy Story-1995,G,30000000,394400000,10/30/1995,Animation,81,8.3,820625,A cowboy doll is profoundly threatened and jealous when a new spaceman figure supplants him as top toy in a boys room.
125,Ace Ventura: When Nature Calls-1995,PG-13,30000000,212400000,11/10/1995,Comedy,90,6.4,191266,"Ace Ventura, Pet Detective, returns from a spiritual quest to investigate the disappearance of a rare white bat, the sacred animal of a tribe in Africa."
134,GoldenEye-1995,PG-13,60000000,356400000,11/16/1995,Action,130,7.2,226013,"Years after a friend and fellow 00 agent is killed on a joint mission, a secret space based weapons program known as Goldeneye is stolen. James Bond sets out to stop a Russian crime syndicate from using the weapon."
135,Jumanji-1995,PG,65000000,262800000,12/15/1995,Family,104,7,277496,"When two kids find and play a magical board game, they release a man trapped for decades in it and a host of dangers that can only be stopped by finishing the game."
122,Grumpier Old Men-1995,PG-13,25000000,71500000,12/22/1995,Comedy,101,6.7,22759,"John and Max resolve to save their beloved bait shop from turning into an Italian restaurant, just as its new female owner catches Maxs attention."
127,Mr. Holland's Opus-1995,PG,31000000,106300000,12/29/1995,Family,137,7.3,33906,A frustrated composer finds fulfillment as a high school music teacher.
147,Broken Arrow-1996,R,50000000,150200000,2/9/1996,Thriller,108,6,86863,Terrorists steal nuclear warheads from the U.S. military but dont count on a pilot and park ranger spoiling their plans.
143,The Birdcage-1996,R,31000000,185300000,3/8/1996,Comedy,117,7.1,74466,A gay cabaret owner and his drag queen companion agree to put up a false straight front so that their son can introduce them to his fiancï¿½es right-wing moralistic parents.
156,Twister-1996,PG-13,92000000,495700000,5/10/1996,Action,113,6.4,164803,"Bill and Jo Harding, advanced storm chasers on the brink of divorce, must join together to create an advanced weather alert system by putting themselves in the cross-hairs of extremely violent tornadoes."
153,Mission: Impossible-1996,PG-13,80000000,457700000,5/22/1996,Action,110,7.1,365266,"An American agent, under false suspicion of disloyalty, must discover and expose the real spy without the help of his organization."
151,The Rock-1996,R,75000000,335100000,6/6/1996,Action,136,7.4,297268,"A mild-mannered chemist and an ex-con must lead the counterstrike when a rogue group of military men, led by a renegade general, threaten a nerve gas attack from Alcatraz against San Francisco."
157,The Hunchback of Notre Dame-1996,PG,70000000,325300000,6/21/1996,Animation,91,6.9,130850,"A deformed bell-ringer must assert his independence from a vicious government minister in order to help his friend, a gypsy dancer."
158,Eraser-1996,R,100000000,242300000,6/21/1996,Drama,115,6.1,98473,A Witness Protection specialist becomes suspicious of his co-workers when dealing with a case involving high-tech weapons.
152,Independence Day-1996,PG-13,75000000,817400000,6/25/1996,Action,145,7,503229,"The aliens are coming and their goal is to invade and destroy Earth. Fighting superior technology, mankinds best weapon is the will to survive."
149,The Nutty Professor-1996,PG-13,54000000,274000000,6/26/1996,Comedy,95,5.6,103475,Grossly overweight yet good-hearted professor Sherman Klump takes a special chemical that turns him into the slim but obnoxious Buddy Love.
144,Phenomenon-1996,PG,32000000,152000000,7/5/1996,Drama,123,6.4,71796,"An ordinary man sees a bright light descend from the sky, and discovers he now has super-intelligence and telekinesis."
145,A Time to Kill-1996,R,40000000,152000000,7/24/1996,Crime,149,7.5,121642,"In Canton, Mississippi, a fearless young lawyer and his assistant defend a black man accused of murdering two white men who raped his ten-year-old daughter, inciting violent retribution and revenge from the Ku Klux Klan."
141,The First Wives Club-1996,PG,26000000,181000000,9/20/1996,Comedy,102,6.4,39451,"Reunited by the death of a college friend, three divorced women seek revenge on the husbands who left them for younger women."
154,Ransom-1996,R,70000000,309500000,11/8/1996,Thriller,117,6.6,112739,"When a multimillionaire mans son is kidnapped, he cooperates with the police at first but then turns the tables on the kidnappers when he uses the ransom money as a reward for the capture of the kidnappers."
142,The English Patient-1996,R,27000000,232000000,11/14/1996,War,162,7.4,168450,"At the close of WWII, a young nurse tends to a badly-burned plane crash victim. His past is shown in flashbacks, revealing an involvement in a fateful love affair."
155,Space Jam-1996,PG,80000000,250200000,11/15/1996,Comedy,88,6.4,145336,"In a desperate attempt to win a basketball match and earn their freedom, the Looney Tunes seek the aid of retired basketball champion, Michael Jordan."
150,101 Dalmatians-1996,G,67000000,320700000,11/17/1996,Comedy,103,5.7,94582,"An evil high-fashion designer plots to steal Dalmatian puppies in order to make an extravagant fur coat, but instead creates an extravagant mess."
146,Star Trek: First Contact-1996,PG-13,45000000,146000000,11/21/1996,Science Fiction,111,7.6,111959,The Borg travel back in time intent on preventing Earths first contact with an alien species. Captain Picard and his crew pursue them to ensure that Zefram Cochrane makes his maiden flight reaching warp speed.
148,Jerry Maguire-1996,R,50000000,273600000,12/6/1996,Comedy,139,7.3,226489,"When a sports agent has a moral epiphany and is fired for expressing it, he decides to put his new philosophy to the test as an independent agent with the only athlete who stays with him and his former secretary."
140,Scream-1996,R,14000000,173000000,12/20/1996,Horror,111,7.2,267513,"A year after the murder of her mother, a teenage girl is terrorized by a new killer, who targets the girl and her friends by using horror films as part of a deadly game."
164,Liar Liar-1997,PG-13,45000000,302700000,3/21/1997,Comedy,86,6.9,264851,A fast-track lawyer cant lie for 24 hours due to his sons birthday wish after he disappoints his son for the last time.
167,The Lost World: Jurassic Park-1997,PG-13,73000000,618600000,5/23/1997,Action,129,6.6,353168,"A research team is sent to the Jurassic Park Site B island to study the dinosaurs there, while an InGen team approaches with another agenda."
168,Con Air-1997,R,75000000,224000000,6/1/1997,Action,115,6.9,261542,Newly paroled ex-con and former U.S. Ranger Cameron Poe finds himself trapped in a prisoner transport plane when the passengers seize control.
177,Batman and Robin-1997,PG-13,160000000,238000000,6/12/1997,Action,125,7.8,978389,Batman and Robin try to keep their relationship together even as they must stop Mr. Freeze and Poison Ivy from freezing Gotham City.
163,My Best Friend's Wedding-1997,PG-13,38000000,299300000,6/19/1997,Comedy,105,6.3,120020,"When a womans long-time friend reveals hes engaged, she realizes she loves him herself and sets out to get him, with only days before the wedding."
172,Hercules-1997,G,85000000,252700000,6/26/1997,Animation,93,7.3,188044,The son of Zeus and Hera is stripped of his immortality as an infant and must become a true hero in order to reclaim it.
170,Face/Off-1997,R,80000000,245700000,6/27/1997,Thriller,138,7.3,331618,"In order to foil a terrorist plot, an FBI agent undergoes a facial transplant surgery and assumes the identity and physical appearance of a terrorist, but the plan turns from bad to worse when the same terrorist impersonates the FBI agent."
174,Men in Black-1997,PG-13,90000000,589400000,7/2/1997,Thriller,98,7.3,486947,A police officer joins a secret organization that polices and monitors extraterrestrial interactions on Earth.
175,Contact-1997,PG,90000000,171100000,7/11/1997,Science Fiction,150,7.4,239569,"Dr. Ellie Arroway (Jodie Foster), after years of searching, finds conclusive radio proof of extraterrestrial intelligence, sending plans for a mysterious machine."
166,George of the Jungle-1997,PG,55000000,174400000,7/15/1997,Family,92,5.4,66725,A man raised in the jungle by apes falls in love with a wealthy American heiress.
173,Air Force One-1997,R,85000000,315200000,7/25/1997,Action,124,6.5,170035,"Communist Radicals hijack Air Force One with The U.S. President and his family on board. The Vice President negotiates from Washington D.C., while the President, a Veteran, fights to rescue the hostages on board."
169,Conspiracy Theory-1997,R,80000000,137000000,8/7/1997,Action,135,6.7,88858,"A man obsessed with conspiracy theories becomes a target after one of his theories turns out to be true. Unfortunately, in order to save himself, he has to figure out which theory it is."
161,I Know What You Did Last Summer-1997,R,17000000,125300000,10/17/1997,Horror,100,5.7,125924,Four young friends bound by a tragic accident are reunited when they find themselves being stalked by a hook-wielding maniac in their small seaside town.
178,Titanic-1997,PG-13,200000000,2195000000,11/18/1997,Romance,194,7.8,978389,"A seventeen-year-old aristocrat falls in love with a kind but poor artist aboard the luxurious, ill-fated R.M.S. Titanic."
171,Flubber-1997,PG,80000000,178000000,11/26/1997,Science Fiction,93,5.3,79581,"An absent-minded professor discovers flubber, a rubber-like super-bouncy substance."
160,Good Will Hunting-1997,R,10000000,225900000,12/5/1997,Drama,126,8.3,787732,"Will Hunting, a janitor at M.I.T., has a gift for mathematics, but needs help from a psychologist to find direction in his life."
162,Scream 2-1997,R,24000000,172400000,12/9/1997,Horror,120,6.2,147635,"Two years after the first series of murders, as Sydney acclimates to college life, someone donning the Ghostface costume begins a new string of killings."
176,Tomorrow Never Dies-1997,PG-13,110000000,333000000,12/11/1997,Action,119,6.5,171081,James Bond heads to stop a media moguls plan to induce war between China and the UK in order to obtain exclusive global media coverage.
165,As Good as It Gets-1997,PG-13,50000000,314100000,12/19/1997,Comedy,139,7.7,258974,"A single mother and waitress, a misanthropic author, and a gay artist form an unlikely friendship after the artist is assaulted in a robbery."
191,Deep Impact-1998,PG-13,80000000,349500000,5/8/1998,Drama,120,6.2,153606,"Unless a comet can be destroyed before colliding with Earth, only those allowed into shelters will survive. Which people will survive?"
196,Godzilla-1998,PG-13,130000000,379000000,5/20/1998,Thriller,139,5.4,174600,"A giant, reptilian monster surfaces, leaving destruction in its wake as it strides into New York City. To stop it, an earthworm scientist, his reporter ex-girlfriend, and other unlikely heroes team up to save their city."
186,The Truman Show-1998,PG,60000000,264100000,6/4/1998,Comedy,103,8.1,859224,An insurance salesman discovers his whole life is actually a reality TV show.
192,Mulan-1998,G,90000000,304300000,6/18/1998,Animation,88,7.6,229669,"To save her father from death in the army, a young maiden secretly goes in his place and becomes one of Chinas greatest heroines in the process."
190,Doctor Dolittle-1998,PG-13,71500000,294400000,6/22/1998,Family,85,5.4,87146,A doctor discovers that he can communicate with animals.
197,Armageddon-1998,PG-13,140000000,553700000,7/1/1998,Science Fiction,151,6.7,376785,"After discovering that an asteroid the size of Texas is going to impact Earth in less than a month, N.A.S.A. recruits a misfit team of deep core drillers to save the planet."
198,Lethal Weapon 4-1998,R,140000000,285400000,7/10/1998,Comedy,127,6.6,145685,"With personal crises and age weighing in on them, LAPD officers Riggs and Murtaugh must contend with deadly Chinese triads that are trying to free their former leaders out of prison and onto American soil."
179,There's Something About Mary-1998,R,23000000,369900000,7/15/1998,Romance,119,7.1,278096,"A man gets a chance to meet up with his dream girl from high school, even though his date with her back then was a complete disaster."
194,The Mask of Zorro-1998,PG-13,95000000,250300000,7/16/1998,Action,136,6.7,159093,"A young thief (Antonio Banderas), seeking revenge for the death of his brother, is trained by the once great, but aged Zorro (Sir Anthony Hopkins), who also pursues vengeance of his own."
188,Saving Private Ryan-1998,R,70000000,481800000,7/24/1998,War,169,8.6,1140752,"Following the Normandy Landings, a group of U.S. soldiers go behind enemy lines to retrieve a paratrooper whose brothers have been killed in action."
183,Rush Hour-1998,PG-13,33000000,244400000,9/18/1998,Comedy,98,7,224449,"A loyal and dedicated Hong Kong Inspector teams up with a reckless and loudmouthed L.A.P.D. detective to rescue the Chinese Consuls kidnapped daughter, while trying to arrest a dangerous crime lord along the way."
180,The Waterboy-1998,PG-13,23000000,190000000,11/6/1998,Comedy,90,6.1,140363,A waterboy for a college football team discovers he has a unique tackling ability and becomes a member of the team.
182,The Rugrats Movie-1998,G,24000000,141000000,11/20/1998,Animation,79,5.9,17025,"Tommy, Chuckie, Phil and Lil gets lost in the forest after adopting a baby who has come to life."
193,Enemy of the State-1998,R,90000000,250800000,11/20/1998,Thriller,132,7.3,216789,A lawyer becomes a target by a corrupt politician and his N.S.A. goons when he accidentally receives key evidence to a serious politically motivated crime.
195,A Bug's Life-1998,G,120000000,363300000,11/25/1998,Animation,95,7.2,251436,"A misfit ant, looking for warriors to save his colony from greedy grasshoppers, recruits a group of bugs that turn out to be an inept circus troupe."
181,Shakespeare in Love-1998,R,25000000,289300000,12/11/1998,History,122,7.1,203939,"A young Shakespeare, out of ideas and short of cash, meets his ideal woman and is inspired to write one of his most famous plays."
189,The Prince of Egypt-1998,PG,70000000,218600000,12/15/1998,Animation,99,7.1,110340,An Egyptian prince learns of his identity as a Hebrew and his destiny to become the chosen deliverer of his people.
187,You've Got Mail-1998,PG,65000000,250800000,12/17/1998,Romance,119,6.6,180707,Two business rivals who despise each other in real life unwittingly fall in love over the Internet.
184,Stepmom-1998,PG-13,50000000,159700000,12/25/1998,Drama,124,6.8,56910,"A terminally-ill woman must deal with her ex-husbands new lover, who will be their childrens stepmother."
185,Patch Adams-1998,PG-13,50000000,202000000,12/25/1998,Drama,115,6.8,97429,"The true story of a heroic man, Hunter Patch Adams, determined to become a medical doctor because he enjoys helping people. He ventured where no doctor had ventured before, using humour and pathos."
210,Analyze This-1999,R,30000000,176900000,3/5/1999,Comedy,103,6.7,139603,A comedy about a psychiatrist whose number one patient is an insecure mob boss.
207,The Matrix-1999,R,63000000,467200000,3/30/1999,Science Fiction,136,8.7,1550148,A computer hacker learns from mysterious rebels about the true nature of his reality and his role in the war against its controllers.
211,The Mummy-1999,PG-13,80000000,416400000,4/16/1999,Adventure,124,7,372009,"At an archaeological dig in the ancient city of Hamunaptra, an American serving in the French Foreign Legion accidentally awakens a mummy who begins to wreck havoc as he searches for the reincarnation of his long-lost love."
204,Notting Hill-1999,PG-13,42000000,363800000,5/13/1999,Romance,124,7.1,251006,The life of a simple bookshop owner changes when he meets the most famous film star in the world.
213,Star Wars: Episode I - The Phantom Menace-1999,PG,115000000,1027000000,5/19/1999,Science Fiction,136,6.5,667362,"Two Jedi escape a hostile blockade to find allies and come across a young boy who may bring balance to the Force, but the long dormant Sith resurface to claim their old glory."
205,The General's Daughter-1999,R,60000000,149700000,6/18/1999,Thriller,116,6.3,49909,"When the daughter of a well-known and well-respected base commander is murdered, an undercover detective is summoned to look into the matter and finds a slew of cover-ups at West Point."
216,Tarzan-1999,PG,130000000,448200000,6/18/1999,Animation,88,7.3,187724,A man raised by gorillas must decide where he really belongs when he discovers he is a human.
202,Big Daddy-1999,PG-13,34200000,234800000,6/25/1999,Comedy,93,6.4,188280,"A lazy law school grad adopts a kid to impress his girlfriend, but everything doesnt go as planned and he becomes the unlikely foster father."
217,Wild Wild West-1999,PG-13,170000000,222100000,6/29/1999,Western,106,4.9,146265,"The two best special agents in the Wild West must save President Grant from the clutches of a diabolical, wheelchair-bound, steampunk-savvy, Confederate scientist bent on revenge for losing the Civil War."
200,American Pie-1999,R,11000000,235500000,7/9/1999,Comedy,95,7,357670,Four teenage boys enter a pact to lose their virginity by prom night.
199,The Blair Witch Project-1999,R,600000,248600000,7/14/1999,Horror,81,6.5,220304,"Three film students vanish after traveling into a Maryland forest to film a documentary on the local Blair Witch legend, leaving only their footage behind."
208,Runaway Bride-1999,PG,70000000,309500000,7/30/1999,Romance,116,5.5,88557,A reporter is assigned to write a story about a woman who has left a string of fiances at the altar.
203,The Sixth Sense-1999,PG-13,40000000,672800000,8/6/1999,Thriller,107,8.1,860079,A boy who communicates with spirits seeks the help of a disheartened child psychologist.
201,American Beauty-1999,R,15000000,356300000,9/15/1999,Drama,122,8.3,1007472,A sexually frustrated suburban father has a mid-life crisis after becoming infatuated with his daughters best friend.
209,Double Jeopardy-1999,R,40000000,177800000,9/24/1999,Crime,105,6.5,67389,"A woman framed for her husbands murder suspects he is still alive; as she has already been tried for the crime, she cant be re-prosecuted if she finds and kills him."
212,Toy Story 2-1999,G,90000000,511300000,10/30/1999,Animation,92,7.9,489299,"When Woody is stolen by a toy collector, Buzz and his friends set out on a rescue mission to save Woody before he becomes a museum toy property with his roundup gang Jessie, Prospector, and Bullseye."
215,The World Is Not Enough-1999,PG-13,135000000,361800000,11/8/1999,Adventure,128,7.4,545440,"James Bond uncovers a nuclear plot while protecting an oil heiress from her former kidnapper, an international terrorist who can't feel pain."
206,The Green Mile-1999,R,60000000,286800000,12/10/1999,Fantasy,189,8.6,1046936,"The lives of guards on Death Row are affected by one of their charges: a black man accused of child murder and rape, yet who has a mysterious gift."
214,Stuart Little-1999,PG,133000000,300100000,12/17/1999,Family,84,5.9,117811,"The Little family adopt a charming young mouse named Stuart, but the family cat wants rid of him."
234,The Perfect Storm-2000,PG-13,120000000,328700000,3/15/2000,Drama,130,6.4,148948,An unusually intense storm pattern catches some commercial fishermen unaware and puts them in mortal danger.
224,Erin Brockovich-2000,R,52000000,256300000,3/17/2000,Drama,131,7.3,161958,An unemployed single mother becomes a legal assistant and almost single-handedly brings down a California power company accused of polluting a citys water supply.
232,Gladiator-2000,R,103000000,503200000,5/1/2000,Action,155,8.5,1243670,A former Roman General sets out to exact vengeance against the corrupt emperor who murdered his family and sent him into slavery.
237,Dinosaur-2000,PG,127500000,349800000,5/19/2000,Animation,82,6.5,48922,An orphaned dinosaur raised by lemurs joins an arduous trek to a sancturary after a meteorite shower destroys his family home.
236,Mission: Impossible II-2000,PG-13,125000000,546400000,5/24/2000,Adventure,123,6.1,296109,"I.M.F. Agent Ethan Hunt (Tom Cruise) is sent to Sydney, Australia to find and destroy a genetically modified disease called Chimera."
220,Big Momma's House-2000,PG-13,30000000,174000000,5/31/2000,Crime,98,5.1,77180,"In order to protect a beautiful woman and her son from a robber, a male FBI agent disguises himself as a large grandmother."
222,Chicken Run-2000,G,45000000,224900000,6/21/2000,Comedy,84,7,167036,"When a cockerel apparently flies into a chicken farm, the chickens see him as an opportunity to escape their evil owners."
233,The Patriot-2000,R,110000000,215300000,6/28/2000,History,165,7.2,241120,Peaceful farmer Benjamin Martin is driven to lead the Colonial Militia during the American Revolution when a sadistic British officer murders his son.
219,Scary Movie-2000,R,19000000,278000000,7/7/2000,Comedy,88,6.2,219032,"A year after disposing of the body of a man they accidentally killed, a group of dumb teenagers are stalked by a bumbling serial killer."
227,X-Men-2000,PG-13,75000000,296300000,7/13/2000,Adventure,104,7.4,545440,"In a world where mutants (evolved super-powered humans) exist and are discriminated against, two groups form for an inevitable clash: the supremacist Brotherhood, and the pacifist X-Men."
231,What Lies Beneath-2000,PG-13,100000000,291400000,7/21/2000,Drama,130,6.6,111917,The wife of a university research scientist believes that her lakeside Vermont home is haunted by a ghost - or that she is losing her mind.
228,Nutty Professor II: The Klumps-2000,PG-13,84000000,166300000,7/27/2000,Comedy,106,4.4,46222,"Scientist Sherman Klumps inventions, his upcoming marriage to his pretty colleague Denise Gaines and his reputation are threatened by his evil clone Buddy Love."
