MovieID,Title,MPAA_Rating,Budget,Gross,Release_Date,Genre,Runtime,Rating,Rating_Count,Summary
221,Remember the Titans-2000,PG,30000000,136800000,9/29/2000,Drama,113,7.8,186997,The true story of a newly appointed African-American coach and his high school team on their first season as a racially integrated unit.
218,"Crouching Tiger, Hidden Dragon-2000",PG-13,17000000,213500000,10/1/2000,Romance,120,7.8,242878,A young Chinese warrior steals a sword from a famed swordsman and then escapes into a world of romantic adventure with a mysterious man in the frontier of the nation.
225,Meet the Parents-2000,PG-13,55000000,330400000,10/6/2000,Comedy,108,7,296549,"Male nurse Greg Focker meets his girlfriends parents before proposing, but her suspicious father is every dates worst nightmare."
230,Charlie's Angels-2000,PG-13,93000000,264100000,11/2/2000,Comedy,98,5.5,166141,"Three women, detectives with a mysterious boss, retrieve stolen voice-ID software, using martial arts, tech skills, and sex appeal."
235,How the Grinch Stole Christmas-2000,PG,123000000,345800000,11/17/2000,Family,104,6.1,186192,"On the outskirts of Whoville, there lives a green, revenge-seeking Grinch (Jim Carrey), who plans on ruining Christmas for all of the citizens of the town."
226,What Women Want-2000,PG-13,70000000,374100000,12/15/2000,Comedy,127,6.4,182948,"After an accident, a chauvinistic executive gains the ability to hear what women are really thinking."
229,Cast Away-2000,PG-13,90000000,429600000,12/22/2000,Drama,143,7.8,482899,A FedEx executive undergoes a physical and emotional transformation after crash landing on a deserted island.
223,Traffic-2000,R,48000000,207500000,12/27/2000,Drama,147,7.6,188060,"A conservative judge is appointed by the President to spearhead Americas escalating war against drugs, only to discover that his teenage daughter is a crack addict. Two DEA agents protect an informant. A jailed drug barons wife attempts to carry on the family business."
247,Hannibal-2001,PG-13,87000000,351600000,2/8/2001,Thriller,131,6.8,240535,"Living in exile, Dr. Hannibal Lecter tries to reconnect with now disgraced F.B.I. Agent Clarice Starling, and finds himself a target for revenge from a powerful victim."
239,Spy Kids-2001,PG,35000000,147900000,3/18/2001,Family,88,5.4,101720,The children of secret-agent parents must save them from danger.
252,The Mummy Returns-2001,PG-13,98000000,435000000,4/28/2001,Adventure,130,6.3,287749,"The mummified body of Imhotep is shipped to a museum in London, where he once again wakes and begins his campaign of rage and terror."
242,Shrek-2001,PG,60000000,487900000,5/16/2001,Animation,90,7.8,574978,"A mean lord exiles fairytale creatures to the swamp of a grumpy ogre, who must go on a quest and rescue a princess for the lord in order to get his land back."
257,Pearl Harbor-2001,PG-13,140000000,450200000,5/21/2001,War,183,6.2,297066,A tale of war and romance mixed in with history. The story follows two lifelong friends and a beautiful nurse who are caught up in the horror of an infamous Sunday morning in 1941.
254,Lara Croft: Tomb Raider-2001,PG-13,115000000,274700000,6/11/2001,Adventure,100,5.8,188607,Video game adventurer Lara Croft comes to life in a movie where she races against time and villains to recover powerful ancient artifacts.
241,The Fast and the Furious-2001,PG-13,38000000,207300000,6/22/2001,Crime,106,6.8,327057,Los Angeles police officer Brian OConner must decide where his loyalty really lies when he becomes enamored with the street racing world he has been sent undercover to destroy.
245,Dr. Dolittle 2-2001,PG,70000000,176100000,6/22/2001,Comedy,87,4.7,39656,Dolittle must save a forest and a bears life.
250,Jurassic Park III-2001,PG-13,93000000,368800000,7/18/2001,Adventure,92,5.9,280110,"A decidedly odd couple with ulterior motives convince Dr. Grant to go to Isla Sorna for a holiday, but their unexpected landing startles the islands new inhabitants."
253,Planet of the Apes-2001,PG-13,100000000,362200000,7/25/2001,Science Fiction,119,5.7,203564,"In 2029, an Air Force astronaut crash-lands on a mysterious planet where evolved, talking apes dominate a race of primitive humans."
240,The Princess Diaries-2001,G,26000000,165300000,8/3/2001,Romance,115,6.3,118754,"Mia Thermopolis has just found out that she is the heir apparent to the throne of Genovia. With her friends Lilly and Michael Moscovitz in tow, she tries to navigate through the rest of her sixteenth year."
248,Rush Hour 2-2001,PG-13,90000000,347300000,8/3/2001,Comedy,90,6.6,188755,"Carter and Lee head to Hong Kong for a vacation, but become embroiled in a counterfeit money scam."
238,American Pie 2-2001,R,30000000,287600000,8/10/2001,Comedy,108,6.4,228537,"Jim and his friends are now in college, and they decide to meet up at the beach house for some fun."
255,"Monsters, Inc.-2001",G,115000000,577400000,11/1/2001,Comedy,92,8,758349,"In order to power the city, monsters have to scare children so that they scream. However, the children are toxic to the monsters, and after a child gets through, 2 monsters realize things may not be what they think."
256,Harry Potter and the Sorcerer's Stone-2001,PG,125000000,1017000000,11/4/2001,Fantasy,152,7.6,583224,"An orphaned boy enrolls in a school of wizardry, where he learns the truth about himself, his family and the terrible evil that haunts the magical world."
246,Ocean's Eleven-2001,PG-13,85000000,450700000,12/7/2001,Thriller,116,7.8,482386,Danny Ocean and his eleven accomplices plan to rob three Las Vegas casinos simultaneously.
244,Vanilla Sky-2001,R,68000000,203400000,12/10/2001,Mystery,136,6.9,237238,A self-indulgent and vain publishing magnate finds his privileged life upended after a vehicular accident with a resentful lover.
243,A Beautiful Mind-2001,PG-13,58000000,316800000,12/11/2001,Drama,135,8.2,788060,"After John Nash, a brilliant but asocial mathematician, accepts secret work in cryptography, his life takes a turn for the nightmarish."
251,The Lord of the Rings: The Fellowship of the Ring-2001,PG-13,93000000,897700000,12/18/2001,Fantasy,178,8.8,1545228,A meek Hobbit from the Shire and eight companions set out on a journey to destroy the powerful One Ring and save Middle-earth from the Dark Lord Sauron.
249,Black Hawk Down-2001,R,92000000,173000000,12/28/2001,War,144,7.7,345280,160 elite U.S. soldiers drop into Somalia to capture two top lieutenants of a renegade warlord and find themselves in a desperate battle with a large force of heavily-armed Somalis.
258,My Big Fat Greek Wedding-2002,PG,5000000,368700000,2/22/2002,Comedy,95,6.5,114907,A young Greek woman falls in love with a non-Greek and struggles to get her family to accept him while she comes to terms with her heritage and cultural identity.
262,Ice Age-2002,PG,59000000,383200000,3/10/2002,Animation,81,7.5,411963,"Set during the Ice Age, a sabertooth tiger, a sloth, and a wooly mammoth find a lost human infant, and they try to return him to his tribe."
274,Spider-Man-2002,PG-13,139000000,825000000,5/1/2002,Fantasy,121,7.3,652224,"When bitten by a genetically modified spider, a nerdy, shy, and awkward high school student gains spider-like abilities that he eventually must use to fight evil as a superhero after tragedy befalls his family."
273,Star Wars: Episode II - Attack of the Clones-2002,PG-13,115000000,653800000,5/15/2002,Science Fiction,142,6.6,587304,"Ten years after initially meeting, Anakin Skywalker shares a forbidden romance with Padmï¿½ Amidala, while Obi-Wan Kenobi investigates an assassination attempt on the senator and discovers a secret clone army crafted for the Jedi."
263,The Bourne Identity-2002,PG-13,60000000,214000000,6/14/2002,Action,119,7.9,481712,"A man is picked up by a fishing boat, bullet-riddled and suffering from amnesia, before racing to elude assassins and attempting to regain his memory."
270,Scooby-Doo-2002,PG,84000000,275700000,6/14/2002,Mystery,88,5,90185,"After an acrimonious break up, the Mystery Inc. gang are individually brought to an island resort to investigate strange goings on."
272,Minority Report-2002,PG-13,102000000,358400000,6/20/2002,Science Fiction,145,7.6,477892,"In a future where a special police unit is able to arrest murderers before they commit their crimes, an officer from that unit is himself accused of a future murder."
269,Lilo & Stitch-2002,PG,80000000,273100000,6/21/2002,Animation,85,6.7,351725,A Hawaiian girl adopts an unusual pet who is actually a notorious extra-terrestrial fugitive.
261,Mr. Deeds-2002,PG-13,50000000,171300000,6/28/2002,Comedy,96,5.8,129182,"A sweet-natured, small-town guy inherits a controlling stake in a media conglomerate and begins to do business his way."
275,Men in Black 2-2002,PG-13,140000000,441800000,7/3/2002,Action,88,7.4,489354,Agent J is sent to find Agent K and restore his memory after the re-appearance of a case from K's past.
264,Austin Powers in Goldmember-2002,PG-13,63000000,296700000,7/26/2002,Science Fiction,94,6.2,186825,"Upon learning that his father has been kidnapped, Austin Powers must travel to 1975 and defeat the aptly named villain Goldmember, who is working with Dr. Evil."
267,Signs-2002,PG-13,72000000,408200000,8/2/2002,Science Fiction,106,6.7,321975,A family living on a farm finds mysterious crop circles in their fields which suggests something more frightening to come.
266,xXx-2002,PG-13,88300000,277400000,8/9/2002,Adventure,124,5.9,167855,"An extreme sports athlete, Xander Cage, is recruited by the government on a special mission."
259,Sweet Home Alabama-2002,PG-13,30000000,180600000,9/26/2002,Romance,108,6.2,96978,"A young woman whos reinvented herself as a New York City socialite must return home to Alabama to obtain a divorce from her husband, after seven years of separation."
260,The Ring-2002,PG-13,48000000,249300000,10/18/2002,Horror,115,7.1,303397,A journalist must investigate a mysterious videotape which seems to cause the death of anyone one week to the day after they view it.
265,The Santa Clause 2-2002,G,65000000,172900000,10/31/2002,Family,104,5.6,45755,"Scott Calvin has been a humble Santa Claus for nearly ten years, but it might come to an end if he doesnt find a Mrs. Claus."
271,Harry Potter and the Chamber of Secrets-2002,PG,100000000,879800000,11/13/2002,Fantasy,161,7.4,505027,An ancient prophecy seems to be coming true when a mysterious presence begins stalking the corridors of a school of magic and leaving its victims paralyzed.
276,Die Another Day-2002,PG-13,142000000,431900000,11/17/2002,Adventure,133,6.1,194441,"James Bond is sent to investigate the connection between a North Korean terrorist and a diamond mogul, who is funding the development of an international space weapon."
268,The Lord of the Rings: The Two Towers-2002,PG-13,94000000,947500000,12/18/2002,Fantasy,179,8.7,1383826,"While Frodo and Sam edge closer to Mordor with the help of the shifty Gollum, the divided fellowship makes a stand against Saurons new ally, Saruman, and his hordes of Isengard."
277,Bringing Down the House-2003,PG-13,33000000,164700000,3/7/2003,Comedy,105,5.6,33619,"When a lonely guy meets a woman on the internet who happens to be in prison, she breaks out to get him to prove her innocence, and proceeds to wreak havoc on his middle-class life."
281,Anger Management-2003,PG-13,75000000,195700000,4/11/2003,Comedy,106,6.2,194353,"Dave Buznik is a businessman who is wrongly sentenced to an anger management program, where he meets an aggressive instructor."
289,X2: X-Men United-2003,PG-13,110000000,407700000,5/2/2003,Action,133,7.4,489354,"When anti-mutant Colonel William Stryker kidnaps Professor X and attacks his school, the X-Men must ally with their archenemy Magneto to stop him."
294,The Matrix Reloaded-2003,R,150000000,741800000,5/15/2003,Science Fiction,138,7.2,487328,"Following the events of The Matrix (1999), Neo and the rebel leaders estimate they have 72 hours until 250,000 probes discover Zion and destroy it and its inhabitants. Neo must decide how he can save Trinity from a dark fate in his dreams."
283,Bruce Almighty-2003,PG-13,81000000,484600000,5/23/2003,Comedy,101,6.7,351725,A guy who complains about God too often is given almighty powers to teach him how difficult it is to run the world.
287,Finding Nemo-2003,G,94000000,940300000,5/30/2003,Animation,100,8.1,887773,"After his son is captured in the Great Barrier Reef and taken to Sydney, a timid clownfish sets out on a journey to bring him home."
282,2 Fast 2 Furious-2003,PG-13,76000000,236400000,6/5/2003,Thriller,107,5.9,236645,Former cop Brian OConner is called upon to bust a dangerous criminal and he recruits the help of a former childhood friend and street racer who has a chance to redeem himself.
291,Hulk-2003,PG-13,137000000,245400000,6/19/2003,Science Fiction,138,5.6,242722,"Bruce Banner, a genetics researcher with a tragic past, suffers an accident that causes him to transform into a raging green monster when he gets angry."
296,Terminator 3: Rise of the Machines-2003,R,187300000,433400000,7/2/2003,Thriller,109,6.3,357127,A cybernetic warrior from a post-apocalyptic future travels back in time to protect a 25-year old drifter and his future wife from a most advanced robotic assassin and to ensure they both survive a nuclear attack.
292,Pirates of the Caribbean: The Curse of the Black Pearl-2003,PG-13,140000000,654300000,7/9/2003,Adventure,143,8,976208,"Blacksmith Will Turner teams up with eccentric pirate Captain Jack Sparrow to save his love, the governors daughter, from Jacks former pirate allies, who are now undead."
290,Bad Boys II-2003,R,130000000,273300000,7/18/2003,Comedy,147,6.6,210294,Two loose-cannon narcotics cops investigate the flow of Ecstasy into Florida from a Cuban drug cartel.
286,Seabiscuit-2003,PG-13,87000000,148300000,7/22/2003,Drama,141,7.3,63813,True story of the undersized Depression-era racehorse whose victories lifted not only the spirits of the team behind it but also those of their nation.
279,Spy Kids 3-D: Game Over-2003,PG,38000000,197000000,7/25/2003,Family,84,4.2,50809,"Carmens caught in a virtual reality game designed by the Kids new nemesis, the Toymaker. Its up to Juni to save his sister, and ultimately the world."
284,S.W.A.T.-2003,PG-13,70000000,207200000,8/8/2003,Crime,117,6,132856,"An imprisoned drug kingpin offers a huge cash reward to anyone that can break him out of police custody, and only the L.A.P.D.s Special Weapons and Tactics team can prevent it."
278,Elf-2003,PG,33000000,225100000,10/9/2003,Comedy,97,6.9,194453,"After discovering he is a human, a man raised as an elf at the North Pole decides to travel to New York City to locate his real father."
295,The Matrix Revolutions-2003,R,150000000,427300000,11/5/2003,Science Fiction,129,6.7,423134,The human city of Zion defends itself against the massive invasion of the machines as Neo fights to end the war at another front while also opposing the rogue Agent Smith.
288,The Lord of the Rings: The Return of the King-2003,PG-13,94000000,1146000000,12/1/2003,Fantasy,201,8.9,1529953,Gandalf and Aragorn lead the World of Men against Saurons army to draw his gaze from Frodo and Sam as they approach Mount Doom with the One Ring.
293,The Last Samurai-2003,R,140000000,456800000,12/5/2003,War,154,7.7,376039,An American military advisor embraces the Samurai culture he was hired to destroy after he is captured in battle.
285,Something's Gotta Give-2003,PG-13,80000000,266700000,12/12/2003,Drama,128,6.7,105201,A swinger on the cusp of being a senior citizen with a taste for young women falls in love with an accomplished woman closer to his age.
280,Cheaper by the Dozen-2003,PG,40000000,190500000,12/24/2003,Comedy,98,5.8,88445,"With his wife doing a book tour, a father of twelve must handle a new job and his unstable brood."
301,50 First Dates-2004,PG-13,75000000,198500000,2/13/2004,Comedy,99,6.8,308950,"Henry Roth is a man afraid of commitment up until he meets the beautiful Lucy. They hit it off and Henry think hes finally found the girl of his dreams, until he discovers she has short-term memory loss and forgets him the next day."
299,The Passion of the Christ-2004,R,30000000,612100000,2/25/2004,Drama,127,7.1,203486,"Depicts the final twelve hours in the life of Jesus of Nazareth, on the day of his crucifixion in Jerusalem."
313,Van Helsing-2004,PG-13,160000000,300200000,5/5/2004,Horror,132,6.1,232864,The notorious monster hunter is sent to Transylvania to stop Count Dracula who is using Dr. Frankensteins research and a werewolf for some sinister purpose.
315,Troy-2004,R,175000000,497400000,5/13/2004,War,163,7.2,460689,"An adaptation of Homers great epic, the film follows the assault on Troy by the united Greek forces and chronicles the fates of the men involved."
312,Shrek 2-2004,PG,150000000,928700000,5/19/2004,Animation,93,7.2,391295,Princess Fionas parents invite her and Shrek to dinner to celebrate her marriage. If only they knew the newlyweds were both ogres.
309,The Day After Tomorrow-2004,PG-13,125000000,552600000,5/26/2004,Action,124,6.4,393340,"Jack Hall, paleoclimatologist, must make a daring trek from Washington, D.C. to New York City to reach his son, trapped in the cross-hairs of a sudden international storm which plunges the planet into a new Ice Age."
310,Harry Potter and the Prisoner of Azkaban-2004,PG,130000000,797700000,5/31/2004,Fantasy,141,7.9,501648,"Its Harrys third year at Hogwarts; not only does he have a new Defense Against the Dark Arts teacher, but there is also trouble brewing. Convicted murderer Sirius Black has escaped the Wizards Prison and is coming after Harry."
298,DodgeBall: A True Underdog Story-2004,PG-13,20000000,168400000,6/18/2004,Comedy,92,6.1,232864,A group of misfits enter a Las Vegas dodgeball tournament in order to save their cherished local gym from the onslaught of a corporate health fitness chain.
297,Fahrenheit 9/11-2004,R,6000000,222400000,6/25/2004,Drama,122,7.5,123244,Michael Moores view on what happened to the United States after September 11; and how the Bush Administration allegedly used the tragic event to push forward its agenda for unjust wars in Afghanistan and Iraq.
316,Spider-Man 2-2004,PG-13,200000000,789000000,6/25/2004,Action,127,7.3,511447,Peter Parker is beset with troubles in his failing personal life as he battles a brilliant scientist named Doctor Otto Octavius.
308,"I, Robot-2004",PG-13,120000000,353100000,7/15/2004,Science Fiction,115,7.1,472748,"In 2035, a technophobic cop investigates a crime that may have been perpetrated by a robot, which leads to a larger threat to humanity."
302,The Bourne Supremacy-2004,PG-13,75000000,290600000,7/23/2004,Action,108,7.7,412796,"When Jason Bourne is framed for a CIA operation gone awry, he is forced to resume his former life as a trained assassin to survive."
300,The Village-2004,PG-13,60000000,256700000,7/30/2004,Drama,108,6.5,231358,A series of events tests the beliefs of a small isolated countryside village.
303,Shark Tale-2004,PG,75000000,374600000,9/20/2004,Animation,90,6,157494,"When a son of a gangster shark boss is accidentally killed while on the hunt, his would-be prey and his vegetarian brother decide to use the incident to their own advantage."
305,The Incredibles-2004,PG,92000000,631600000,11/5/2004,Animation,115,8,617102,"A family of undercover superheroes, while trying to live the quiet suburban life, are forced into action to save the world."
314,The Polar Express-2004,G,165000000,314100000,11/10/2004,Animation,100,6.6,158237,"On Christmas Eve, a young boy embarks on a magical adventure to the North Pole on the Polar Express, while learning about friendship, bravery, and the spirit of Christmas."
306,National Treasure-2004,PG,100000000,347500000,11/19/2004,Mystery,131,6.8,289084,A historian races to find the legendary Templar Treasure before a team of mercenaries.
307,Ocean's Twelve-2004,PG-13,110000000,362900000,12/9/2004,Thriller,125,6.5,337180,Daniel Ocean recruits one more team member so he can pull off three major European heists in this sequel to Oceans 11.
311,Lemony Snicket's A Series of Unfortunate Events-2004,PG,140000000,211500000,12/16/2004,Comedy,108,6.8,187021,"When a massive fire kills their parents, three children are delivered to the custody of cousin and stage actor Count Olaf, who is secretly plotting to steal their parents vast fortune."
304,Meet the Fockers-2004,PG-13,80000000,522700000,12/22/2004,Comedy,115,6.3,241144,All hell breaks loose when the Byrnes family meets the Focker family for the first time.
322,Hitch-2005,PG-13,70000000,371600000,2/10/2005,Comedy,118,6.6,282005,"While helping his latest client woo the woman of his dreams, a professional date doctor finds that his game doesnt quite work on the gossip columnist with whom hes smitten."
321,The Pacifier-2005,PG,56000000,198600000,3/4/2005,Comedy,95,5.6,82064,"Having recovered from wounds received in a failed rescue operation, Navy SEAL Shane Wolfe is handed a new assignment: Protect the five Plummer kids from enemies of their recently deceased father -- a government scientist whose top-secret experiment remains in the kids house."
323,Robots-2005,PG,75000000,262500000,3/10/2005,Animation,91,6.3,124743,"In a robot world, a young idealistic inventor travels to the big city to join his inspirations company, only to find himself opposing its sinister new management."
329,Star Wars: Episode III - Revenge of the Sith-2005,PG-13,113000000,868400000,5/17/2005,Science Fiction,140,7.5,653713,"Three years into the Clone Wars, the Jedi rescue Palpatine from Count Dooku. As Obi-Wan pursues a new threat, Anakin acts as a double agent between the Jedi Council and Palpatine and is lured into a sinister plan to rule the galaxy."
325,The Longest Yard-2005,PG-13,90000000,191500000,5/19/2005,Drama,113,6.4,153016,Prison inmates form a football team to challenge the prison guards.
324,Madagascar-2005,PG,75000000,556600000,5/25/2005,Animation,86,6.9,340576,"A group of animals who have spent all their life in a New York zoo end up in the jungles of Madagascar, and must adjust to living in the wild."
328,Mr. & Mrs. Smith-2005,PG-13,110000000,487300000,6/7/2005,Comedy,120,6.7,150380,Two secret agents from opposing corporations get married without either knowing that the other is an agent. When their roles are discovered their marriage begins to fall apart.
331,Batman Begins-2005,PG-13,150000000,373700000,6/10/2005,Action,140,8.2,1222163,"After training with his mentor, Batman begins his fight to free crime-ridden Gotham City from corruption."
330,War of the Worlds-2005,PG-13,132000000,603900000,6/28/2005,Science Fiction,116,6.5,394088,"As Earth is invaded by alien tripod fighting machines, one family fights for survival in this sci-fi action film."
326,Fantastic Four-2005,PG-13,100000000,333500000,6/29/2005,Action,106,5.7,300723,"A group of astronauts gain superpowers after a cosmic radiation exposure and must use them to oppose the plans of their enemy, Doctor Victor Von Doom."
332,Charlie and the Chocolate Factory-2005,PG,150000000,475000000,7/13/2005,Family,115,6.6,397238,"A young boy wins a tour through the most magnificent chocolate factory in the world, led by the worlds most unusual candy maker."
319,Wedding Crashers-2005,R,40000000,288500000,7/14/2005,Comedy,119,6.9,318291,"John Beckwith and Jeremy Grey, a pair of committed womanizers who sneak into weddings to take advantage of the romantic tinge in the air, find themselves at odds with one another when John meets and falls for Claire Cleary."
317,The 40 Year Old Virgin-2005,R,26000000,177400000,8/11/2005,Comedy,116,7.7,500448,"Goaded by his buddies, a nerdy guy who's never ""done the deed"" only finds the pressure mounting when he meets a single mother."
318,Walk the Line-2005,PG-13,28000000,187000000,9/13/2005,Drama,136,7.8,218317,"A chronicle of country music legend Johnny Cashs life, from his early days on an Arkansas cotton farm to his rise to fame with Sun Records in Memphis, where he recorded alongside Elvis Presley, Jerry Lee Lewis, and Carl Perkins."
320,Flightplan-2005,PG-13,55000000,223000000,9/22/2005,Thriller,98,6.3,145570,"A bereaved woman and her daughter are flying home from Berlin to America. At 30,000 feet, the child vanishes, and nobody will admit she was ever on the plane."
333,Chicken Little-2005,G,150000000,314400000,11/4/2005,Animation,81,5.7,80293,"After ruining his reputation with the town, a courageous chicken must come to the rescue of his fellow citizens when aliens start an invasion."
334,Harry Potter and the Goblet of Fire-2005,PG-13,150000000,896700000,11/5/2005,Fantasy,157,7.7,500448,"A young wizard finds himself competing in a hazardous tournament between rival schools of magic, but he is distracted by recurring nightmares."
335,"The Chronicles of Narnia: The Lion, the Witch and the Wardrobe-2005",PG,180000000,745000000,12/7/2005,Fantasy,143,6.9,345525,Four kids travel through a wardrobe to the land of Narnia and learn of their destiny to free it with the guidance of a mystical lion.
336,King Kong-2005,PG-13,207000000,562300000,12/14/2005,Adventure,187,7.2,372684,"A greedy film producer assembles a team of moviemakers and sets out for the infamous Skull Island, where they find more than just cannibalistic natives."
327,Fun with Dick and Jane-2005,PG-13,100000000,204700000,12/21/2005,Comedy,90,6.1,126990,"When an affluent couple lose all their money following a series of blunders, they turn to a life of crime to make ends meet."
344,Ice Age: The Meltdown-2006,PG,80000000,660900000,3/23/2006,Animation,91,6.8,240160,"Manny, Sid, and Diego discover that the ice age is coming to an end, and join everybody for a journey to higher ground. On the trip, they discover that Manny, in fact, is not the last of the woolly mammoths."
